{
  "schema": "openprose.launch-adapter/1",
  "id": "mock/in-memory",
  "runtime": "deterministic-mock",
  "promptPlacement": "developer",
  "preservesHarnessBasePrompt": "enforced",
  "sourceBytesVerified": "enforced",
  "adapterInputContentVerified": "enforced",
  "modelRequestObserved": "unsupported",
  "streaming": "structured",
  "cancellation": "unsupported",
  "terminal": "structured",
  "resume": "unsupported",
  "isolation": "test-fixture",
  "auth": ["none-test-only"],
  "billingOwner": "test-fixture",
  "observedBy": ["sentinel-terminal-envelope"],
  "platforms": [
    "darwin-arm64",
    "darwin-x64",
    "linux-x64-gnu",
    "linux-arm64-gnu",
    "win32-x64"
  ],
  "versionRange": "=1.0.0",
  "transportClaims": ["base-transport-compatible"],
  "normalizationBoundary": "in-memory sentinel image and task values"
}
